{"ts": "2026-06-10T15:23:13+00:00", "attempt": 1, "hypothesis": "baseline (no change) \u2014 record starting point", "change": "none (baseline)", "files": [], "results": {"favorable_h8_s4096_d64": {"ns": 12232917.0, "util": 1.09, "pcc": 0.99999}, "favorable_h8_s8192_d128": {"ns": 54953359.0, "util": 1.94, "pcc": 1.0}}, "decision": "keep", "note": "starting numbers from current kernel"}
{"ts": "2026-06-10T15:36:25+00:00", "attempt": 2, "hypothesis": "HiFi3->HiFi2 halves matmul passes; if FPU were bottleneck device_kernel_ns drops ~2x", "change": "op default math_fidelity HiFi3->HiFi2; test util peak rescaled to 129 TFLOPs (user request)", "files": [], "results": {"favorable_h8_s4096_d64": {"ns": 12207709.0, "util": 2.18, "pcc": 0.99997}, "favorable_h8_s8192_d128": {"ns": 54574628.0, "util": 3.9, "pcc": 0.99999}, "favorable_h16_s8192_d128": {"ns": 109076486.0, "util": 3.9, "pcc": 0.99996}, "very_favorable_h8_s16384_d512": {"ns": 1017530873.0, "util": 3.35, "pcc": 0.99992}}, "decision": "keep", "note": "device_kernel_ns flat (case1 12.23->12.21ms): matmul not the bottleneck; util doubles only via peak rescale. Baseline now case1 2.18%, case2 3.90%, case3 3.90%, case4 3.35%"}
{"ts": "2026-06-10T15:37:52+00:00", "attempt": 3, "hypothesis": "d=512 c_kv=1 makes softmax fire per KV tile; c_kv=4 should cut case4 ns", "change": "program_descriptor: c_kv = min(4, Skv_t), decoupled from 16//Dt clamp", "files": [], "results": {"favorable_h8_s4096_d64": {"ns": 12208553.0, "util": 2.18, "pcc": 0.99997}, "favorable_h8_s8192_d128": {"ns": 54579907.0, "util": 3.9, "pcc": 0.99999}, "favorable_h16_s8192_d128": {"ns": 109069751.0, "util": 3.9, "pcc": 0.99996}, "very_favorable_h8_s16384_d512": {"ns": 1025227481.0, "util": 3.32, "pcc": 0.99992}}, "decision": "keep", "note": "case4 FLAT (1017->1025ms), cases1-3 unchanged: case4 is DRAM-BW bound (~139GB KV reload/run); keep for later softmax amortization, real lever is c_q/KV reuse"}
{"ts": "2026-06-10T15:39:07+00:00", "attempt": 4, "hypothesis": "bf16 DEST halves stat traffic, smaller acc CBs; precision drop acceptable (bar 0.99)", "change": "op default fp32_dest_acc_en=False for bf16 inputs", "files": [], "results": {"favorable_h8_s4096_d64": {"ns": 6252655.0, "util": 4.25, "pcc": 0.99966}, "favorable_h8_s8192_d128": {"ns": 31082198.0, "util": 6.85, "pcc": 0.99878}, "favorable_h16_s8192_d128": {"ns": 62092145.0, "util": 6.85, "pcc": 0.99882}, "very_favorable_h8_s16384_d512": {"ns": 988198198.0, "util": 3.45, "pcc": 0.9949}}, "decision": "keep", "note": "case1 12.2->6.25ms (4.25%), case2/3 ->6.85%, case4 BW-bound only 1025->988ms; pcc worst 0.9949 (case4)"}
{"ts": "2026-06-10T15:43:07+00:00", "attempt": 5, "hypothesis": "KV traffic ~1/c_q; c_q 1->4 quarters BW for d=512", "change": "c_q floor 4; c_kv stays 4 (halving compounds bf16 error <0.99); cb_out single-buffered at Dt>8 to fit L1", "files": [], "results": {"favorable_h8_s4096_d64": {"ns": 6252937.0, "util": 4.25, "pcc": 0.99966}, "favorable_h8_s8192_d128": {"ns": 31084799.0, "util": 6.85, "pcc": 0.99878}, "favorable_h16_s8192_d128": {"ns": 62089193.0, "util": 6.85, "pcc": 0.99882}, "very_favorable_h8_s16384_d512": {"ns": 277470517.0, "util": 12.27, "pcc": 0.9949}}, "decision": "keep", "note": "case4 1017->277ms (12.27%) pcc 0.9949; intermediate c_kv=2 try at 0.9788 rejected; cases1-3 flat"}
{"ts": "2026-06-10T15:48:33+00:00", "attempt": 6, "hypothesis": "online-softmax bookkeeping dominates; randn+scale needs no max subtraction at PCC 0.99", "change": "compute fast path (mask-free, uniform chunks): P=exp(scale*S), l+=rowsum, O+=PV; rowmax/alpha/rescale removed. L1-acc K-blocked PV first try gave pcc~0 -> SFPU O+=PV instead", "files": [], "results": {"favorable_h8_s4096_d64": {"ns": 3172215.0, "util": 8.39, "pcc": 0.99965}, "favorable_h8_s8192_d128": {"ns": 15202648.0, "util": 14.0, "pcc": 0.99879}, "favorable_h16_s8192_d128": {"ns": 30307709.0, "util": 14.04, "pcc": 0.99883}, "very_favorable_h8_s16384_d512": {"ns": 304884719.0, "util": 11.17, "pcc": 0.99514}}, "decision": "keep", "note": "case1 6.25->3.17ms 8.39%, case2 31->15.2ms 14.0%, case3 14.0%, case4 305ms 11.17%, all pcc>=0.995; l1_acc variant was ~10% faster but garbage"}
{"ts": "2026-06-10T15:49:52+00:00", "attempt": 7, "hypothesis": "c_kv 4->8 halves O-acc share at small Dt and fewer steps improve bf16 acc", "change": "c_kv = min(8 if Dt<=8 else 4, Skv_t)", "files": [], "results": {"favorable_h8_s4096_d64": {"ns": 2879052.0, "util": 9.24, "pcc": 0.99986}, "favorable_h8_s8192_d128": {"ns": 14335319.0, "util": 14.84, "pcc": 0.99962}, "favorable_h16_s8192_d128": {"ns": 27543755.0, "util": 15.45, "pcc": 0.9997}, "very_favorable_h8_s16384_d512": {"ns": 300326035.0, "util": 11.34, "pcc": 0.99514}}, "decision": "keep", "note": "9.24/14.84/15.45/11.34%; pcc improved (case1 0.99986)"}
{"ts": "2026-06-10T15:56:36+00:00", "attempt": 8, "hypothesis": "fast exp helps only if compute-bound", "change": "Exp Approx::Fast + DeviceZoneScopedN instrumentation", "files": [], "results": {"favorable_h8_s4096_d64": {"ns": 1850874.0, "util": 14.37, "pcc": 0.99971}, "favorable_h8_s8192_d128": {"ns": 16710208.0, "util": 12.73, "pcc": 0.99946}, "favorable_h16_s8192_d128": {"ns": 32722872.0, "util": 13.01, "pcc": 0.99953}, "very_favorable_h8_s16384_d512": {"ns": 292824342.0, "util": 11.63, "pcc": 0.99499}}, "decision": "keep", "note": "case1 9.24->14.38%; case2/3 ~flat (DRAM-bound on KV reload, ~4GB/s/core ~ DRAM peak); zones: QKT 33k cyc, PV 28k vs ideal 4k = waits"}
{"ts": "2026-06-10T15:58:27+00:00", "attempt": 9, "hypothesis": "DRAM KV reload bound: doubling c_q halves traffic; c_kv=8 only at Dt<=2 amortizes per-block stat for compute-leaning d=64", "change": "c_q = 8 if Dt<=4 else 4; c_kv = 8 if Dt<=2 else 4", "files": [], "results": {"favorable_h8_s4096_d64": {"ns": 1833518.0, "util": 14.51, "pcc": 0.99971}, "favorable_h8_s8192_d128": {"ns": 10904785.0, "util": 19.51, "pcc": 0.99865}, "favorable_h16_s8192_d128": {"ns": 21676493.0, "util": 19.63, "pcc": 0.99868}, "very_favorable_h8_s16384_d512": {"ns": 294306666.0, "util": 11.57, "pcc": 0.99499}}, "decision": "keep", "note": "14.51% / 19.51% / 19.63% / 11.57%, all pcc >= 0.995. Cases 2/3 at ~20% target; next: case1 + case4"}
{"ts": "2026-06-10T16:02:44+00:00", "attempt": 10, "hypothesis": "FPU add (ckl::add) is cheaper than SFPU copy-add-pack for O+=PV", "change": "OACC: ckl::add<cb_o_acc,cb_pv,cb_o_acc,...,Bulk,Streaming,Bulk>", "files": [], "results": {"favorable_h8_s4096_d64": {"ns": 1824319.0, "util": 14.58, "pcc": 0.99971}, "favorable_h8_s8192_d128": {"ns": 10904743.0, "util": 19.51, "pcc": 0.99865}, "favorable_h16_s8192_d128": {"ns": 21670759.0, "util": 19.64, "pcc": 0.99868}, "very_favorable_h8_s16384_d512": {"ns": 292354054.0, "util": 11.65, "pcc": 0.99499}}, "decision": "revert", "note": "device hang (same-CB Bulk read/write deadlock); reverted to SFPU chain, gate green again 14.58/19.51/19.64/11.65"}
{"ts": "2026-06-10T16:11:17+00:00", "attempt": 11, "hypothesis": "Cases DRAM-bound; KV row-mcast cuts traffic by group size", "change": "reader+descriptor: leader reads KV per block, mcasts to head group; semaphores 0/1", "files": [], "results": {"favorable_h8_s4096_d64": {"ns": 1827644.0, "util": 14.55, "pcc": 0.99971}, "favorable_h8_s8192_d128": {"ns": 10929612.0, "util": 19.47, "pcc": 0.99865}, "favorable_h16_s8192_d128": {"ns": 21777331.0, "util": 19.54, "pcc": 0.99868}, "very_favorable_h8_s16384_d512": {"ns": 115104810.0, "util": 29.58, "pcc": 0.99499}}, "decision": "keep", "note": "case4 292->115ms 29.58%! Cases1-3 flat -> per-core, not DRAM-aggregate bound. Re-profiling case2"}
{"ts": "2026-06-10T16:14:58+00:00", "attempt": 12, "hypothesis": "OACC removable via packer L1 acc; needs disarm in pre-K + single-block o_acc", "change": "PV = one Nkv-K-block matmul (l1 acc to interm o_acc), llk_pack_reconfig_l1_acc(0) in pre-K, cb_o_acc 1 block on fast path", "files": [], "results": {"favorable_h8_s4096_d64": {"ns": 1662000.0, "util": 16.0, "pcc": 0.99976}, "favorable_h8_s8192_d128": {"ns": 8464444.0, "util": 25.14, "pcc": 0.99967}, "favorable_h16_s8192_d128": {"ns": 16883152.0, "util": 25.21, "pcc": 0.99969}, "very_favorable_h8_s16384_d512": {"ns": 119313503.0, "util": 28.54, "pcc": 0.99941}}, "decision": "keep", "note": "16.00/25.14/25.21/28.54; pcc up (case4 0.99941, l1 acc fp32-precise vs bf16 SFPU add)"}
{"ts": "2026-06-10T16:17:03+00:00", "attempt": 13, "hypothesis": "scale*S per block redundant; Q'=scale*Q once per unit removes MulUnary from per-block exp", "change": "compute: pre-scale Q to cb_scores_scaled per unit; exp chain copy+exp only; descriptor: cb_scores_scaled c_q*Dt", "files": [], "results": {"favorable_h8_s4096_d64": {"ns": 1119702.0, "util": 23.76, "pcc": 0.99976}, "favorable_h8_s8192_d128": {"ns": 6312352.0, "util": 33.71, "pcc": 0.99968}, "favorable_h16_s8192_d128": {"ns": 12437265.0, "util": 34.22, "pcc": 0.99971}, "very_favorable_h8_s16384_d512": {"ns": 119004719.0, "util": 28.61, "pcc": 0.99942}}, "decision": "keep", "note": "23.76/33.71/34.22/28.61; cases2/3 past 30%; next: split KV mcast across NoCs (V via writer)"}
{"ts": "2026-06-10T16:20:02+00:00", "attempt": 14, "hypothesis": "case4 NoC0-saturated (532KB read + 532KB mcast/block); moving V to writer NoC1 halves reader bytes", "change": "writer produces cb_v (DRAM read + row-mcast on NoC1, sems 2/3); reader keeps Q+K^T", "files": [], "results": {"favorable_h8_s4096_d64": {"ns": 1115230.0, "util": 23.85, "pcc": 0.99976}, "favorable_h8_s8192_d128": {"ns": 6257798.0, "util": 34.01, "pcc": 0.99968}, "favorable_h16_s8192_d128": {"ns": 12456731.0, "util": 34.17, "pcc": 0.99971}, "very_favorable_h8_s16384_d512": {"ns": 65486934.0, "util": 51.99, "pcc": 0.99942}}, "decision": "keep", "note": "case4 119->65.5ms = 51.99%; cases1-3 flat; only case1 below 30% (exp-pass dominant)"}
{"ts": "2026-06-10T16:22:22+00:00", "attempt": 15, "hypothesis": "LoFi matmuls + Bulk scores consume", "change": "math fidelity LoFi (reverted, flat) + exp chain Bulk lifecycle (kept, neutral)", "files": [], "results": {"favorable_h8_s4096_d64": {"ns": 1119470.0, "util": 23.76, "pcc": 0.99976}, "favorable_h8_s8192_d128": {"ns": 6305456.0, "util": 33.75, "pcc": 0.99968}, "favorable_h16_s8192_d128": {"ns": 12565150.0, "util": 33.87, "pcc": 0.99971}, "very_favorable_h8_s16384_d512": {"ns": 65888667.0, "util": 51.68, "pcc": 0.99942}}, "decision": "keep", "note": "23.76/33.75/33.87/51.68 \u2014 FPU fidelity not binding; case1 exp-bound"}
{"ts": "2026-06-10T16:24:47+00:00", "attempt": 16, "hypothesis": "l += rowsum chain removable via packer L1 acc on one-block cb_cur_sum", "change": "reduce packs L1-acc into cb_cur_sum; drop l-update chain + l init", "files": [], "results": {"favorable_h8_s4096_d64": {"ns": 1033581.0, "util": 25.74, "pcc": 0.99975}, "favorable_h8_s8192_d128": {"ns": 5620394.0, "util": 37.86, "pcc": 0.9997}, "favorable_h16_s8192_d128": {"ns": 11188263.0, "util": 38.04, "pcc": 0.99969}, "very_favorable_h8_s16384_d512": {"ns": 63455374.0, "util": 53.66, "pcc": 0.99946}}, "decision": "keep", "note": "25.74/37.86/38.04/53.66 \u2014 only case1 short of 30%"}
{"ts": "2026-06-10T16:30:01+00:00", "attempt": 17, "hypothesis": "exp on DEST in QKT PostCompute removes scores CB round-trip", "change": "ExpPost in QKT matmul, out=cb_probs, exp pass deleted", "files": [], "results": {"favorable_h8_s4096_d64": {"ns": 954271.0, "util": 27.87, "pcc": 0.99972}, "favorable_h8_s8192_d128": {"ns": 5355967.0, "util": 39.73, "pcc": 0.9997}, "favorable_h16_s8192_d128": {"ns": 10626693.0, "util": 40.05, "pcc": 0.99969}, "very_favorable_h8_s16384_d512": {"ns": 62445923.0, "util": 54.52, "pcc": 0.99946}}, "decision": "keep", "note": "27.87/39.73/40.05/54.52 \u2014 case1 last below 30"}
{"ts": "2026-06-10T16:42:53+00:00", "attempt": 18, "hypothesis": "PV ones-column kills rowsum where extra width cheap", "change": "V[Dt+1] ones-col @Dt=4 (Dt=2 reverted: +50% width regressed case1 28->19.7)", "files": [], "results": {"favorable_h8_s4096_d64": {"ns": 954013.0, "util": 27.88, "pcc": 0.99972}, "favorable_h8_s8192_d128": {"ns": 5141965.0, "util": 41.39, "pcc": 0.99969}, "favorable_h16_s8192_d128": {"ns": 10165258.0, "util": 41.87, "pcc": 0.99969}, "very_favorable_h8_s16384_d512": {"ns": 62374844.0, "util": 54.59, "pcc": 0.99946}}, "decision": "keep", "note": "27.88/41.39/41.87/54.59 \u2014 case1 last gap"}
{"ts": "2026-06-10T16:46:04+00:00", "attempt": 19, "hypothesis": "rowsum as matmul vs reduce", "change": "matmul P@ones-col for rowsum (REVERTED: case1 27.88->24.84, helper overhead)", "files": [], "results": {"favorable_h8_s4096_d64": {"ns": 1067185.0, "util": 24.93, "pcc": 0.99972}, "favorable_h8_s8192_d128": {"ns": 5150286.0, "util": 41.32, "pcc": 0.99969}, "favorable_h16_s8192_d128": {"ns": 10192307.0, "util": 41.76, "pcc": 0.99969}, "very_favorable_h8_s16384_d512": {"ns": 62588261.0, "util": 54.4, "pcc": 0.99946}}, "decision": "revert", "note": "back to L1-acc reduce"}
{"ts": "2026-06-10T16:50:48+00:00", "attempt": 20, "hypothesis": "pinned interm removes per-K FIFO churn", "change": "pin_interm_to_captured_base=true + SubblockMajor (1xV_W subblocks == row-major)", "files": [], "results": {"favorable_h8_s4096_d64": {"ns": 945963.0, "util": 28.12, "pcc": 0.99972}, "favorable_h8_s8192_d128": {"ns": 5003219.0, "util": 42.53, "pcc": 0.99969}, "favorable_h16_s8192_d128": {"ns": 9875816.0, "util": 43.1, "pcc": 0.99969}, "very_favorable_h8_s16384_d512": {"ns": 61217185.0, "util": 55.62, "pcc": 0.99946}}, "decision": "keep", "note": "28.12/42.53/43.10/55.62; case1 needs 1.9pt \u2014 try c_q=16,c_kv=16 (Dt=2)"}
{"ts": "2026-06-10T17:15:44+00:00", "attempt": 21, "hypothesis": "DEST-filling subblocks via TileRowMajor h>1; QKT h=2 only at short K", "change": "PV 2xsw TileRowMajor at Dt>8; QKT 2x c_kv at Dt<=4; ones_col back to mcast Dt 3-4", "files": [], "results": {"favorable_h8_s4096_d64": {"ns": 894866.0, "util": 29.73, "pcc": 0.99972}, "favorable_h8_s8192_d128": {"ns": 4829596.0, "util": 44.06, "pcc": 0.99969}, "favorable_h16_s8192_d128": {"ns": 9523413.0, "util": 44.69, "pcc": 0.99969}, "very_favorable_h8_s16384_d512": {"ns": 59003923.0, "util": 57.7, "pcc": 0.99946}}, "decision": "keep", "note": "29.73/44.06/44.69/57.70 all pcc>=0.9994"}
{"ts": "2026-06-10T17:18:21+00:00", "attempt": 22, "hypothesis": "leaders on one column congest DRAM/NoC; diagonal spreads", "change": "leader at x = row%g (group rect args first/last/leader)", "files": [], "results": {"favorable_h8_s4096_d64": {"ns": 884895.0, "util": 30.06, "pcc": 0.99972}, "favorable_h8_s8192_d128": {"ns": 4824685.0, "util": 44.11, "pcc": 0.99969}, "favorable_h16_s8192_d128": {"ns": 9533028.0, "util": 44.64, "pcc": 0.99969}, "very_favorable_h8_s16384_d512": {"ns": 58248830.0, "util": 58.45, "pcc": 0.99946}}, "decision": "keep", "note": "30.06/44.11/44.64/58.45 \u2014 all >=30%"}
{"ts": "2026-06-10T17:22:38+00:00", "attempt": 23, "hypothesis": "case4 focus: DEST-filling pinned 2x4 PV + subblock-major final pass; deeper KV buffers latency", "change": "PV SubblockMajor 2xsw + pin + segment final pass (keep); 3-deep KT/V (revert, flat); cb_pv 1 page on fast path (keep)", "files": [], "results": {"favorable_h8_s4096_d64": {"ns": 885447.0, "util": 30.04, "pcc": 0.99972}, "favorable_h8_s8192_d128": {"ns": 4827371.0, "util": 44.08, "pcc": 0.99969}, "favorable_h16_s8192_d128": {"ns": 9535582.0, "util": 44.63, "pcc": 0.99969}, "very_favorable_h8_s16384_d512": {"ns": 56794815.0, "util": 59.95, "pcc": 0.99946}}, "decision": "keep", "note": "FINAL: 30.04/44.08/44.63/59.95, all pcc>=0.99946, cores 64/64 \u2014 all four >=30% goal"}
{"ts": "2026-06-10T17:41:49+00:00", "attempt": 24, "hypothesis": "V mcast on reader (single NoC0, one combined K+V handshake) might beat dual-NoC", "change": "reader read+mcast V alongside K^T (REVERTED)", "files": [], "results": {"favorable_h8_s4096_d64": {"ns": 884988.0, "util": 30.06, "pcc": 0.99972}, "favorable_h8_s8192_d128": {"ns": 4825103.0, "util": 44.1, "pcc": 0.99969}, "favorable_h16_s8192_d128": {"ns": 9532584.0, "util": 44.65, "pcc": 0.99969}, "very_favorable_h8_s16384_d512": {"ns": 56794419.0, "util": 59.95, "pcc": 0.99946}}, "decision": "revert", "note": "case4 59.95->45.64 (NoC0 saturates at 1.06MB/block); cases1-3 ~flat; dual-NoC split is load-bearing. Reverted, gate green at 30.06/44.10/44.65/59.95"}
